{
  "$schema": "http://json-schema.org/draft-07/schema#",
  "$id": "https://cpokuru.github.io/CoreRDK-Broadband-Platform/schemas/memory-footprint.schema.json",
  "title": "RDK-B Core Broadband Memory Footprint by Process",
  "description": "Per-profile measured (or pending) memory footprint by process (RSS). Kept as a separate file from hw-compat.schema.json so footprint data can be updated as components are profiled without touching the CPU/RAM/flash/peripheral spec file.",
  "type": "object",
  "required": ["specVersion", "profileId", "measured", "processes"],
  "properties": {
    "specVersion": {
      "type": "string",
      "description": "Version of this JSON schema (semantic version), e.g. \"1.0\"."
    },
    "profileId": {
      "type": "string",
      "description": "Matches the profileId in the corresponding hw-compat.schema.json file for this profile."
    },
    "measured": {
      "type": "boolean",
      "description": "True if RSS has been measured on a reference device for at least one process; false if this profile is pending profiling."
    },
    "referenceDevice": {
      "type": "string",
      "description": "Optional. Device the measurement was taken on, e.g. \"BPI-R4 (MediaTek MT7988, Filogic)\"."
    },
    "lastMeasured": {
      "type": "string",
      "format": "date",
      "description": "Optional. ISO-8601 date (YYYY-MM-DD) of the most recent measurement pass."
    },
    "totalRssMB": {
      "type": "number",
      "description": "Optional. Total measured RSS in MB across all processes, including any not individually listed."
    },
    "processes": {
      "type": "array",
      "description": "Per-process RSS entries, typically sorted descending by rssMB. Empty when measured is false.",
      "items": {
        "type": "object",
        "required": ["process", "rssMB"],
        "properties": {
          "process": { "type": "string", "description": "Process or component name, e.g. \"OneWifi\"." },
          "rssMB": {
            "anyOf": [{ "type": "number" }, { "type": "string", "enum": ["TBD"] }],
            "description": "Resident set size in MB, or \"TBD\" if this specific process has not yet been measured."
          },
          "componentRepo": { "type": "string", "description": "Optional. RDK-B Component List repo name for cross-reference." }
        }
      }
    },
    "othersRssMB": {
      "type": "number",
      "description": "Optional. Aggregate RSS in MB for remaining processes not individually broken out."
    },
    "notes": {
      "type": "string",
      "description": "Optional. Free-text notes, e.g. explaining what 'Others' covers or why a profile is unmeasured."
    }
  }
}
