{
  "$schema": "https://cpokuru.github.io/CoreRDK-Broadband-Platform/schemas/memory-footprint.schema.json",
  "specVersion": "1.0",
  "profileId": "ethwan-wifi-router",
  "measured": true,
  "referenceDevice": "BPI-R4 (MediaTek MT7988A/Filogic 880), combined EthWAN + EasyMesh Controller/Agent build (production-style image, no dev tooling)",
  "lastMeasured": "2026-09-17",
  "totalRssMB": 1053.06,
  "processes": [
    {
      "process": "onewifi_em_ctrl",
      "rssMB": 271.95
    },
    {
      "process": "onewifi_em_agent",
      "rssMB": 215.38
    },
    {
      "process": "OneWifi",
      "rssMB": 74.26
    },
    {
      "process": "mariadbd",
      "rssMB": 61.04
    },
    {
      "process": "asterisk",
      "rssMB": 30.59
    },
    {
      "process": "onewifi_em_cli",
      "rssMB": 24.65
    },
    {
      "process": "CcspPandMSsp",
      "rssMB": 17.85
    },
    {
      "process": "mdnsd",
      "rssMB": 13.24
    },
    {
      "process": "snmp_subagent",
      "rssMB": 11.81
    },
    {
      "process": "telemetry2_0",
      "rssMB": 11.21
    },
    {
      "process": "parodus",
      "rssMB": 11.07
    },
    {
      "process": "CcspTr069PaSsp",
      "rssMB": 10.67
    },
    {
      "process": "obuspa",
      "rssMB": 10.39
    },
    {
      "process": "cellularmanager",
      "rssMB": 9.89
    },
    {
      "process": "ModemManager",
      "rssMB": 9.67
    },
    {
      "process": "snmpd",
      "rssMB": 9.63
    },
    {
      "process": "webconfig",
      "rssMB": 9.43
    },
    {
      "process": "PsmSsp",
      "rssMB": 9.38
    },
    {
      "process": "telcovoice_manager",
      "rssMB": 9.09
    },
    {
      "process": "CcspTandDSsp",
      "rssMB": 8.96
    },
    {
      "process": "systemd",
      "rssMB": 8.77
    },
    {
      "process": "CcspXdnsSsp",
      "rssMB": 8.48
    },
    {
      "process": "CcspEthAgent",
      "rssMB": 7.89
    },
    {
      "process": "CcspLMLite",
      "rssMB": 7.72
    },
    {
      "process": "systemd-journald",
      "rssMB": 7.7
    },
    {
      "process": "IGD",
      "rssMB": 7.69
    },
    {
      "process": "wanmanager",
      "rssMB": 7.5
    },
    {
      "process": "CcspDHCPMgr",
      "rssMB": 7.23
    },
    {
      "process": "webpa",
      "rssMB": 7.11
    },
    {
      "process": "gw_prov_utopia",
      "rssMB": 7.02
    },
    {
      "process": "CcspCrSsp",
      "rssMB": 6.95
    },
    {
      "process": "ieee1905",
      "rssMB": 6.73
    },
    {
      "process": "remotedebugger",
      "rssMB": 6.72
    },
    {
      "process": "ieee1905",
      "rssMB": 6.68
    },
    {
      "process": "DobbyDaemon",
      "rssMB": 6.65
    },
    {
      "process": "CcspAdvSecurity",
      "rssMB": 6.6
    },
    {
      "process": "VlanManager",
      "rssMB": 6.01
    },
    {
      "process": "fwupgrademanager",
      "rssMB": 5.89
    },
    {
      "process": "systemd-udevd",
      "rssMB": 5.27
    },
    {
      "process": "dsm",
      "rssMB": 5.02
    },
    {
      "process": "hal-voice-asterisk",
      "rssMB": 4.14
    },
    {
      "process": "rtrouted",
      "rssMB": 3.78
    },
    {
      "process": "rdkbLogMonitor.",
      "rssMB": 3.54
    },
    {
      "process": "selfheal_aggressive",
      "rssMB": 3.53
    },
    {
      "process": "dibbler-client",
      "rssMB": 3.29
    },
    {
      "process": "dbus-daemon",
      "rssMB": 2.87
    },
    {
      "process": "syseventd",
      "rssMB": 2.86
    },
    {
      "process": "self_heal_conne",
      "rssMB": 2.8
    },
    {
      "process": "zebra",
      "rssMB": 2.75
    },
    {
      "process": "resource_monito",
      "rssMB": 2.69
    },
    {
      "process": "sh",
      "rssMB": 2.58
    },
    {
      "process": "trigger",
      "rssMB": 2.52
    },
    {
      "process": "mysqld_safe",
      "rssMB": 2.47
    },
    {
      "process": "lighttpd",
      "rssMB": 2.44
    },
    {
      "process": "sh",
      "rssMB": 2.41
    },
    {
      "process": "ntp-data-collec",
      "rssMB": 2.34
    },
    {
      "process": "syseventd_fork_",
      "rssMB": 2.22
    },
    {
      "process": "login",
      "rssMB": 2.09
    },
    {
      "process": "ntpd",
      "rssMB": 2.04
    },
    {
      "process": "rbus_session_mg",
      "rssMB": 2.03
    },
    {
      "process": "netlink-button-",
      "rssMB": 1.86
    },
    {
      "process": "crond",
      "rssMB": 1.86
    },
    {
      "process": "dnsmasq",
      "rssMB": 1.77
    },
    {
      "process": "nfq_handler",
      "rssMB": 1.74
    },
    {
      "process": "klogd",
      "rssMB": 1.7
    },
    {
      "process": "dropbear",
      "rssMB": 1.7
    },
    {
      "process": "syslogd",
      "rssMB": 1.68
    },
    {
      "process": "syslogd",
      "rssMB": 1.68
    },
    {
      "process": "klogd",
      "rssMB": 1.67
    },
    {
      "process": "udhcpc",
      "rssMB": 1.58
    },
    {
      "process": "igmpproxy",
      "rssMB": 1.41
    },
    {
      "process": "rdisc",
      "rssMB": 1.32
    },
    {
      "process": "ninfod",
      "rssMB": 1.23
    },
    {
      "process": "sleep",
      "rssMB": 1.12
    },
    {
      "process": "sleep",
      "rssMB": 1.12
    },
    {
      "process": "sleep",
      "rssMB": 1.12
    },
    {
      "process": "sleep",
      "rssMB": 1.11
    },
    {
      "process": "sleep",
      "rssMB": 1.11
    },
    {
      "process": "sleep",
      "rssMB": 1.1
    }
  ],
  "notes": "Full RSS capture, 79 processes with nonzero VmRSS (captured via /proc/<pid>/status on the live device; the capture script's own process is excluded from this list). System-level used memory (MemTotal - MemAvailable, per Section 3.5 MEM-006 guidance) is 905.6 MiB \u2014 up from 573-631 MiB in earlier snapshots, tracking the onewifi_em_ctrl/onewifi_em_agent growth below. totalRssMB (1053.06) is the GROSS sum of listed processes and double-counts shared pages across processes; it does not equal the 905.6 MiB system-level figure. This capture shows no netdata, ollama, or apps.plugin \u2014 the earlier capture's dev-only tooling \u2014 confirming this is a cleaner, more production-representative image than the original baseline. mariadbd is still present (still not normative for either in-scope profile). \n\nThree-point growth history for the two flagged processes, in chronological order: onewifi_em_ctrl 118.7 MiB \u2192 236.9 MiB \u2192 271.9 MiB (this capture); onewifi_em_agent 21.0 MiB \u2192 64.2 MiB \u2192 215.4 MiB (this capture), the last point now over 10x its original value and larger than OneWifi itself. Three consecutive increases is materially stronger evidence toward a genuine leak than the earlier two-point 'growth vs. leak, undistinguished' framing \u2014 this has not been reclassified as a confirmed leak, since exact device uptime at each capture is not recorded and the formal 72-hour soak test (MEM-008 criterion) still has not been run, but this pattern warrants prioritizing that soak test. \n\nA handful of process names could not be independently de-truncated from this capture's 15-character-limited /proc/<pid>/status Name field and are recorded as truncated: rdkbLogMonitor. (likely rdkbLogMonitor.sh), self_heal_conne, resource_monito, ntp-data-collec, syseventd_fork_, netlink-button-. Names confirmed against the earlier full-name capture (onewifi_em_agent, telcovoice_manager, systemd-journald, fwupgrademanager, hal-voice-asterisk, selfheal_aggressive) have been corrected to their full spelling here."
}
